{
  "id": "yt_ruben_sseje4vpgpu",
  "kind": "video",
  "title": "Estrategia EURUSD Ganadora (Daytrading)",
  "url": "https://www.youtube.com/watch?v=sSeJe4VPGpU&t=87s",
  "author": "Rubén Martínez",
  "accessed_at": "2026-08-02",
  "language": "es",
  "sq_version": null,
  "source_level": "C_EXPLORATORY",
  "domain": "strategyquant",
  "rights_policy": "metadata_only",
  "metadata": {"video_id": "sSeJe4VPGpU", "shared_start_seconds": 87, "review_status": "metadata_captured_content_pending", "curated_by_user": true},
  "chunks": [{"locator": "metadata:oembed", "heading": "Cas EURUSD day trading", "body": "Vídeo de Rubén Martínez aportat per l'usuari com a cas EURUSD intradia. L'adjectiu guanyadora forma part del títol i no és una conclusió de l'Acadèmia.", "evidence_status": "captured"}]
}
