{
  "id": "paper_white_data_snooping_2000",
  "kind": "paper",
  "title": "A Reality Check for Data Snooping",
  "url": "https://doi.org/10.1111/1468-0262.00152",
  "author": "Halbert White",
  "published_at": "2000-09-01",
  "accessed_at": "2026-08-02",
  "language": "en",
  "sq_version": null,
  "source_level": "A_PRIMARY",
  "domain": "research-methods",
  "rights_policy": "transformative_notes",
  "metadata": {"journal": "Econometrica", "doi": "10.1111/1468-0262.00152"},
  "chunks": [
    {"locator": "abstract:data-snooping", "heading": "Reutilització de dades", "body": "White defineix data snooping com reutilitzar les mateixes dades per inferència o selecció de models; així, un resultat satisfactori pot aparèixer per atzar durant la cerca.", "evidence_status": "corroborated"},
    {"locator": "abstract:benchmark", "heading": "Superioritat predictiva", "body": "El Reality Check contrasta la hipòtesi que el millor model trobat en una cerca no té superioritat predictiva respecte d'un benchmark, incorporant l'efecte de la cerca.", "evidence_status": "captured"}
  ]
}
