{
  "id": "wgc_gold_demand_q1_2026", "kind": "documentation", "title": "Gold Demand Trends Q1 2026 press release",
  "url": "https://www.gold.org/download/file/20795/Q1_2026_GDT_Press_Release_29_April.pdf", "author": "World Gold Council", "published_at": "2026-04-29", "accessed_at": "2026-08-02",
  "language": "en", "sq_version": null, "source_level": "A_PRIMARY", "domain": "market-regimes", "rights_policy": "transformative_notes",
  "metadata": {"pages": 2, "scope": "Q1 demand and price-regime evidence."},
  "chunks": [
    {"locator": "page:1:price", "heading": "2026 price and volatility", "body": "El WGC informa que la volatilitat va augmentar marcadament el 2026 i que el preu va superar 5.400 USD/unça al gener abans d'una correcció.", "evidence_status": "captured"},
    {"locator": "page:1:flows", "heading": "2026 flows", "body": "Q1: demanda total 1.231 tones, ETF físics +62 tones i bancs centrals +244 tones, per sobre del trimestre anterior i de la mitjana de cinc anys.", "evidence_status": "captured"}
  ]
}
