{
  "id": "wgc_gold_demand_2025", "kind": "web", "title": "Gold Demand Trends: Full Year 2025",
  "url": "https://www.gold.org/goldhub/research/gold-demand-trends/gold-demand-trends-full-year-2025", "author": "World Gold Council", "published_at": "2026-01-29", "accessed_at": "2026-08-02",
  "language": "en", "sq_version": null, "source_level": "A_PRIMARY", "domain": "market-regimes", "rights_policy": "transformative_notes",
  "metadata": {"scope": "Demand statistics and price context; not a trading recommendation."},
  "chunks": [
    {"locator": "highlights:price", "heading": "2025 price regime", "body": "El LBMA PM va marcar 53 màxims històrics el 2025; el preu en dòlars va augmentar un 67% i el preu mitjà anual fou 3.431 USD/unça.", "evidence_status": "captured"},
    {"locator": "highlights:demand", "heading": "Demand structure", "body": "La demanda total va superar 5.000 tones; els ETF van afegir 801 tones i els bancs centrals 863 tones, encara un nivell històricament elevat malgrat baixar respecte de 2024.", "evidence_status": "captured"}
  ]
}
