{
  "id": "sq_official_automatic_retest_144", "kind": "documentation",
  "title": "Automatic retest task", "url": "https://strategyquant.com/doc/strategyquant/automatic-retest/",
  "author": "StrategyQuant", "published_at": "2020-05-11", "accessed_at": "2026-08-02",
  "language": "en", "sq_version": "144+", "source_level": "A_PRIMARY",
  "domain": "strategyquant", "rights_policy": "transformative_notes",
  "metadata": {"version_warning": "La secció actual descriu una actualització des de Build 144; no assumir disponible a 143.2708."},
  "chunks": [
    {"locator": "section:update-144", "heading": "Update from version 144", "body": "Des de Build 144, Automatic Retest carrega estratègies d'un Databank font, prova combinacions configurades de símbols, timeframes i paràmetres, i desa resultats al Databank destí segons ranking.", "evidence_status": "captured"}
  ]
}
